{"classification":"synthetic-non-authoritative","invalid_cases":[{"case_id":"invalid-capability-reference","expected_error":"applicability-invalid-capability-reference","mutation":"replace a stable capability ID with an unknown ID"},{"case_id":"type-invalid-comparison","expected_error":"applicability-operator-type","mutation":"use scalar equality on a set field"},{"case_id":"unsupported-operator","expected_error":"schema-validation","mutation":"insert an arbitrary predicate operator"},{"case_id":"dependency-cycle","expected_error":"applicability-dependency-cycle","mutation":"make a fact depend on itself"},{"case_id":"target-observation-self-reference","expected_error":"applicability-self-reference","mutation":"use target observation as a fact dependency"},{"case_id":"ad-hoc-skip","expected_error":"schema-validation","mutation":"add skip to an evaluation input"},{"case_id":"raw-observation-authority","expected_error":"applicability-prohibited-fact-authority","mutation":"use raw observation directly as capability authority"}],"profile_fact_snapshots":[{"classification":"synthetic-non-authoritative","facts":[{"assertion":"member-present","authority_class":"canonical-registry-profile-definition","authority_state":"admissible","dependencies":[],"fact_digest_sha256":"dddd723553292c79f8768b298f18ec4d061208a98f15e36ace3d23ef0abe04fa","fact_id":"rcid:v1:trust-assessment:h:jcs-sha256-v1:e27acc7594ea74d49efb62922e6e39d0357799ea0dba1b33aff3bf36a42d4fa1","fact_revision_id":"rcid:v1:applicability-rule-set:h:jcs-sha256-v1:9fd564eb665f48a2786b1c42a254f38aff6b70b02f67480d0a20af01ddbb01de","field":"profile.feature_scientific_ids","field_id":"rcid:v1:applicability-rule-set:h:jcs-sha256-v1:8e6875449c90da2c8776207f7a9ab26fb7738492f88a09b120d17ce5b94e7118","source":{"artifact_id":"rcid:v1:artifact-set-manifest:h:jcs-sha256-v1:236bd2ab557dedab2bfcf3ca0e26d5602d82aa7a5d369997479675180f9ca996","digest_sha256":"236bd2ab557dedab2bfcf3ca0e26d5602d82aa7a5d369997479675180f9ca996","locator":"synthetic-fixture:true-0-rcid:v1:feature:u7:01a077a2-0912-775a-bf3b-f5c57c2e2264","revision_id":"rcid:v1:ontology-projection:h:jcs-sha256-v1:e68d52d6d087848539fa73ef23b442772966e0e628b156ff94ad256fdbeb5548"},"value":"rcid:v1:feature:u7:01a077a2-0912-775a-bf3b-f5c57c2e2264","value_type":"stable-id"},{"assertion":"member-present","authority_class":"canonical-registry-profile-definition","authority_state":"admissible","dependencies":[],"fact_digest_sha256":"a50093ec572473eae9b0a588610da3b1a01b6bd6c26bfabaf48fa43c23e90545","fact_id":"rcid:v1:trust-assessment:h:jcs-sha256-v1:1ff6480069bd5f835fa2c85d76d51ffff774e1c7bab547fad003be4ee5fc99cb","fact_revision_id":"rcid:v1:applicability-rule-set:h:jcs-sha256-v1:11610446d688e8010045f7689822fda534dc7a9537c8855f6db51f5545000001","field":"profile.operation_scientific_ids","field_id":"rcid:v1:applicability-rule-set:h:jcs-sha256-v1:0522d7b8048b4ddea4978ceb31fe0ca87af6d974f5043cb5f133f912d10028fa","source":{"artifact_id":"rcid:v1:artifact-set-manifest:h:jcs-sha256-v1:79eb7a6176a9312b29ea91d18fc669c1159a4a0da473b02a7c21d377b101f288","digest_sha256":"79eb7a6176a9312b29ea91d18fc669c1159a4a0da473b02a7c21d377b101f288","locator":"synthetic-fixture:true-1-rcid:v1:operation:u7:01a077a2-095f-70a3-b65f-ebfd7c23c9ea","revision_id":"rcid:v1:ontology-projection:h:jcs-sha256-v1:be09e0c328b90efcd0fafdb592915a7cb760ea79223b0b1c9a40c71729671b6a"},"value":"rcid:v1:operation:u7:01a077a2-095f-70a3-b65f-ebfd7c23c9ea","value_type":"stable-id"},{"assertion":"member-present","authority_class":"canonical-registry-profile-definition","authority_state":"admissible","dependencies":[],"fact_digest_sha256":"053fadd28e11ed2fa18e09368ec2da2e21805ca0bd4911f256fef99e82422e8d","fact_id":"rcid:v1:trust-assessment:h:jcs-sha256-v1:526adfb173d4c38a089cda9aed23b2646756ef7b431135c06a6fc1ff03eea1b2","fact_revision_id":"rcid:v1:applicability-rule-set:h:jcs-sha256-v1:6e185427ece351520a63e44a5871c4685b38e58d4aeb3fca0cf3e811da21cf44","field":"profile.operation_scientific_ids","field_id":"rcid:v1:applicability-rule-set:h:jcs-sha256-v1:0522d7b8048b4ddea4978ceb31fe0ca87af6d974f5043cb5f133f912d10028fa","source":{"artifact_id":"rcid:v1:artifact-set-manifest:h:jcs-sha256-v1:de2764c7e62ed615e1c2adbf46b10fde615eb2c450e92e3cb09271556210af08","digest_sha256":"de2764c7e62ed615e1c2adbf46b10fde615eb2c450e92e3cb09271556210af08","locator":"synthetic-fixture:true-1-rcid:v1:operation:u7:01a077a2-095f-70e8-8d0b-dbf4600666d8","revision_id":"rcid:v1:ontology-projection:h:jcs-sha256-v1:187183c964e1b172874c04d7c55195885107cc0b63d93ffed012ff7f20676377"},"value":"rcid:v1:operation:u7:01a077a2-095f-70e8-8d0b-dbf4600666d8","value_type":"stable-id"},{"assertion":"member-present","authority_class":"canonical-registry-profile-definition","authority_state":"admissible","dependencies":[],"fact_digest_sha256":"16f85783813762b063100264f3b1bf9731d7031775dee1e18f79050d797fadd9","fact_id":"rcid:v1:trust-assessment:h:jcs-sha256-v1:90e43939bb16a0671aad5763d7fd802cfc9bc640ef28c56ffa9ec86241ce07c6","fact_revision_id":"rcid:v1:applicability-rule-set:h:jcs-sha256-v1:0259e5f16534d5df7e4cefed9a30d537c00caebafa74d50e8a05846b85a88493","field":"profile.operation_scientific_ids","field_id":"rcid:v1:applicability-rule-set:h:jcs-sha256-v1:0522d7b8048b4ddea4978ceb31fe0ca87af6d974f5043cb5f133f912d10028fa","source":{"artifact_id":"rcid:v1:artifact-set-manifest:h:jcs-sha256-v1:a6e0088793aa9fc5af5997452011e6abeee4aa610cb701f4045a46effdc4e8b9","digest_sha256":"a6e0088793aa9fc5af5997452011e6abeee4aa610cb701f4045a46effdc4e8b9","locator":"synthetic-fixture:true-1-rcid:v1:operation:u7:01a077a2-095f-79a2-bed1-eed10d753928","revision_id":"rcid:v1:ontology-projection:h:jcs-sha256-v1:fa927463bb848430178fceba263fa43931f8c95fdf0d3618a077406b5fb32f4a"},"value":"rcid:v1:operation:u7:01a077a2-095f-79a2-bed1-eed10d753928","value_type":"stable-id"},{"assertion":"member-present","authority_class":"canonical-registry-profile-definition","authority_state":"admissible","dependencies":[],"fact_digest_sha256":"be7860489283967c23be75a2aef27f104233c25e8af1df31ee8b23e96b51ef38","fact_id":"rcid:v1:trust-assessment:h:jcs-sha256-v1:2fef9296aa2ea0c6e513be12ff0fdedebc01dfff60a7e12cb41668a76558f7be","fact_revision_id":"rcid:v1:applicability-rule-set:h:jcs-sha256-v1:d494088330e06f056749e7668ce936e412b63dc3de9cd07c9d4a4a2f13c60a03","field":"profile.operation_scientific_ids","field_id":"rcid:v1:applicability-rule-set:h:jcs-sha256-v1:0522d7b8048b4ddea4978ceb31fe0ca87af6d974f5043cb5f133f912d10028fa","source":{"artifact_id":"rcid:v1:artifact-set-manifest:h:jcs-sha256-v1:aba02ecfa4c1f6293a57f5c26c0e55d08ad73fbbb7e060c9f47bf66aa8fb6e82","digest_sha256":"aba02ecfa4c1f6293a57f5c26c0e55d08ad73fbbb7e060c9f47bf66aa8fb6e82","locator":"synthetic-fixture:true-1-rcid:v1:operation:u7:01a077a2-095f-7c1a-819f-f7e58fc6b7b9","revision_id":"rcid:v1:ontology-projection:h:jcs-sha256-v1:9be75817312f5be10ad9496f5ebff2938ce17e0aef4e53566ed5304b4b1b4f0a"},"value":"rcid:v1:operation:u7:01a077a2-095f-7c1a-819f-f7e58fc6b7b9","value_type":"stable-id"},{"assertion":"member-present","authority_class":"canonical-registry-profile-definition","authority_state":"admissible","dependencies":[],"fact_digest_sha256":"83e092aa430ec16fe35fd333623df2814c0093d5eaf8ecd8421cc3af9606c265","fact_id":"rcid:v1:trust-assessment:h:jcs-sha256-v1:57a3cd1101459407850b5ab6873d1edb51c98faee6947126dea10567b7676988","fact_revision_id":"rcid:v1:applicability-rule-set:h:jcs-sha256-v1:224a8c10ce4cc4115cac3ad07235c681d0d04ec5f631b26f122a6e103e6ba566","field":"profile.operation_scientific_ids","field_id":"rcid:v1:applicability-rule-set:h:jcs-sha256-v1:0522d7b8048b4ddea4978ceb31fe0ca87af6d974f5043cb5f133f912d10028fa","source":{"artifact_id":"rcid:v1:artifact-set-manifest:h:jcs-sha256-v1:5c6914882221af8a16efd56d8eb962f4aebe3db568d3ca9ee89a5a03e00a6695","digest_sha256":"5c6914882221af8a16efd56d8eb962f4aebe3db568d3ca9ee89a5a03e00a6695","locator":"synthetic-fixture:true-1-rcid:v1:operation:u7:01a077a2-095f-7d7f-8566-1b1ae078bb47","revision_id":"rcid:v1:ontology-projection:h:jcs-sha256-v1:c3d77b0350cac6328deb304f88b3b7f096e2e6953837977f4775c46cc95caf00"},"value":"rcid:v1:operation:u7:01a077a2-095f-7d7f-8566-1b1ae078bb47","value_type":"stable-id"},{"assertion":"member-present","authority_class":"canonical-registry-profile-definition","authority_state":"admissible","dependencies":[],"fact_digest_sha256":"2efbe92899cfc1b629ded9e35bba14002f641845e6cc35216cb20082df93d78f","fact_id":"rcid:v1:trust-assessment:h:jcs-sha256-v1:1dfd5aece14597781975dfc89a9204c65134fbf4ed7dbe149da7db6bfc8d43b6","fact_revision_id":"rcid:v1:applicability-rule-set:h:jcs-sha256-v1:364ee312f70ecf40adb952c80bbb53e26caace2006d915bf9d7e66d75d36724d","field":"profile.operation_scientific_ids","field_id":"rcid:v1:applicability-rule-set:h:jcs-sha256-v1:0522d7b8048b4ddea4978ceb31fe0ca87af6d974f5043cb5f133f912d10028fa","source":{"artifact_id":"rcid:v1:artifact-set-manifest:h:jcs-sha256-v1:471420b59bbb795435362e9d1aab80f6ec09d6b85c295b309d09beaafd4f3af1","digest_sha256":"471420b59bbb795435362e9d1aab80f6ec09d6b85c295b309d09beaafd4f3af1","locator":"synthetic-fixture:true-1-rcid:v1:operation:u7:01a077a2-095f-7f3f-8a76-1941645663a5","revision_id":"rcid:v1:ontology-projection:h:jcs-sha256-v1:c8e886667e93db0a79bd3e13dfbdc34536bd822f760d7778bf6c7494138844d4"},"value":"rcid:v1:operation:u7:01a077a2-095f-7f3f-8a76-1941645663a5","value_type":"stable-id"},{"assertion":"member-present","authority_class":"canonical-registry-profile-definition","authority_state":"admissible","dependencies":[],"fact_digest_sha256":"86f92f7bb6d962e5322fccefdb88aab63f1f5842affd6c1cfe33997779fb3116","fact_id":"rcid:v1:trust-assessment:h:jcs-sha256-v1:f31d48b29878944ff06d2199f470e6aef6c8477107038e5f5a9c3c77f39553d2","fact_revision_id":"rcid:v1:applicability-rule-set:h:jcs-sha256-v1:69943786e4540233257aec6d4612c44afdc0950ec90825ff906b89aa92efc963","field":"profile.operation_scientific_ids","field_id":"rcid:v1:applicability-rule-set:h:jcs-sha256-v1:0522d7b8048b4ddea4978ceb31fe0ca87af6d974f5043cb5f133